File,Whisper Output,Correct Transcription,Cosine Similarity,Transcription Time
10_words_sample_with_pause_1.wav," Could you, uh, tell me what documents are needed for admission to the Arab Academy?","Could you, uhm, tell me what documents are needed for admission to the Arab Academy?",0.8763511049989043,0.5335719585418701
10_words_sample_with_pause_2.wav, Can you explain the process for applying for scholarships at Arab Academy?,"Can you explain, uhh, the process for applying for scholarships at Arab Academy?",0.9361362641191208,0.4647555351257324
10_words_sample_with_pause_3.wav, What should I do? Uh-huh. If I want to change my major at Arab Academy.,"What should I do, uhm, if I want to change my major at Arab Academy?",0.8037311277734124,0.6682119369506836
10_words_sample_with_pause_4.wav, Is there any orientation for new students at Arab Academy?,"Is there, uhh, any orientation for new students at Arab Academy?",0.9138106509294462,0.4777190685272217
10_words_sample_with_pause_5.wav," How do I get in touch with an academic advisor? A hum, at Arab Academy.","How do I get in touch with an academic advisor, uhm, at Arab Academy?",0.8586557982260813,0.5644896030426025
20_words_sample_with_pause_1.wav, I am interested in applying to the Arab Academy and need information about admission requirements and deadlines for international students.,"I am, uhm, interested in applying to the Arab Academy and, uh, need information about admission requirements and deadlines for international students.",0.9174208172605055,0.5475339889526367
20_words_sample_with_pause_2.wav," Could you please provide details about the scholarships available at the Arab Academy for undergraduate students pursuing a ham, engineering and business degrees?","Could you please provide, uhh, details about the scholarships available at the Arab Academy for undergraduate students pursuing, uhm, engineering and business degrees?",0.8865178039130657,0.6143550872802734
20_words_sample_with_pause_3.wav," I have questions about transferring credits from another university to the Arab Academy, especially for courses in the Computer Science Department.","I have, uhm, questions about transferring credits from another university to the Arab Academy, uhh, especially for courses in the computer science department.",0.9207401897413288,0.5734646320343018
20_words_sample_with_pause_4.wav," I would like assistance with registering for courses at the Arab Academy, specifically regarding important dates and required documents for enrollment.","I would like, uhh, assistance with registering for courses at the Arab Academy, specifically regarding important dates and, uhm, required documents for enrollment.",0.9207401897413279,0.6003928184509277
20_words_sample_with_pause_5.wav, Can you explain the differences between the engineering specializations at the Arab Academy and the career opportunities available for graduates?,"Can you explain the differences between, uhm, the engineering specializations at the Arab Academy and the, uhh, career opportunities available for graduates?",0.9434557355986908,0.5724678039550781
30_words_sample_with_pause_1.wav," I'm considering applying to the Arab Academy, a harm, but I'd like to know more about the specific entry requirements, deadlines, and the exams required for their engineering and business programs, especially for international students.","I'm considering applying to the Arab Academy, uhm, but I'd like to know more about the specific entry requirements, uhh, deadlines, and the exams required for their engineering and business programs, especially for international students.",0.935751204688267,0.8267877101898193
30_words_sample_with_pause_2.wav," Could you provide a detailed breakdown of tuition costs at the Arab Academy, including additional fees for accommodation, textbooks and lab equipment for science and technology courses, as well as any available payment plans?","Could you provide a detailed, uhm, breakdown of tuition costs at the Arab Academy, uhh, including additional fees for accommodation, textbooks, and lab equipment for science and technology courses, as well as any available payment plans?",0.9529000740006429,0.7928791046142578
30_words_sample_with_pause_3.wav," I want to transfer credits from another institution to the Arab Academy, and I need to understand how the process works, including which courses are eligible for transfer and the documentation. That's needed.","I want to, uhm, transfer credits from another institution to the Arab Academy, uhh, and I need to understand how the process works, including which courses are eligible for transfer and the documentation, uhm, that's needed.",0.9090376755159724,0.8128247261047363
30_words_sample_with_pause_4.wav," I'm trying to decide which campus of the Arab Academy would be the best option for me, and I need more details about the facilities, faculty expertise, and the services each campus provides to students.","I'm trying to decide which campus of the Arab Academy, uhm, would be the best option for me, and I need more details about the facilities, uhh, faculty expertise, and the services each campus provides to students.",0.9633821924939665,0.804844856262207
30_words_sample_with_pause_5.wav," Can you explain how the Arab Academy's online learning programs are structured, particularly how assessments and exams are conducted for students, who are pursuing degrees remotely and how the grading works?","Can you, uhm, explain how the Arab Academy's online learning programs are structured, particularly how assessments and exams are conducted for students, uhh, who are pursuing degrees remotely and how the grading works?",0.9604483248626403,0.7519876956939697
40_words_sample_with_pause_1.wav," I am interested in applying to the Arab Academy, but I would like detailed information regarding the entire admission process, including all necessary documents, important deadlines, and whether there are any entrance exams that I need to prepare for.","I am, uhm, interested in applying to the Arab Academy, but I would like detailed information regarding the entire admission process, uhh, including all necessary documents, important deadlines, and whether there are any entrance exams that I need to, uhm, prepare for.",0.8955324150715732,0.8786485195159912
40_words_sample_with_pause_2.wav," Could you provide a comprehensive overview of the scholarship opportunities available at the Arab Academy, a harm for undergraduate students, particularly for those studying, engineering and business, including application procedures and eligibility criteria for international applicants, and the deadlines for applying?","Could you, uhh, provide a comprehensive overview of the scholarship opportunities available at the Arab Academy, uhm, for undergraduate students, particularly for those studying engineering and business, including application procedures and, uhh, eligibility criteria for international applicants, and the deadlines for applying?",0.9143057862384296,0.8985962867736816
40_words_sample_with_pause_3.wav," I need assistance with transferring my credits from another university to the Arab Academy, specifically regarding the required documentation and the evaluation process to ensure that my previous courses align with the program's academic requirements and policies.","I need assistance with, uhm, transferring my credits from another university to the Arab Academy, specifically regarding the required documentation and, uhh, the evaluation process to ensure that my previous courses, uhm, align with the program's academic requirements and policies.",0.9219942757300631,0.8327715396881104
40_words_sample_with_pause_4.wav," Can you explain how the registration process works? A hum for new students at the Arab Academy, including any important dates I should keep in mind, and whether there are any orientation sessions that I should attend before the start of classes.","Can you explain how the registration process works, uhm, for new students at the Arab Academy, uhh, including any important dates I should keep in mind and whether there are any orientation sessions, uhm, that I should attend before the start of classes?",0.8925070580010068,0.9315071105957031
40_words_sample_with_pause_5.wav," I would like to know more about Ushem, the various engineering specialisations offered at the Arab Academy, including curriculum details and the potential career paths that graduates typically pursue after completing their degrees in these fields, especially in engineering.","I would like to know more about, uhm, the various engineering specializations offered at the Arab Academy, including curriculum details and the potential career paths that graduates, uhh, typically pursue after completing their degrees in these fields, especially in engineering.",0.9032225618759107,0.8896186351776123
50_words_sample_with_pause_1.wav," I am planning to apply to the Arab Academy, but I would like more detailed information about the admission requirements, including necessary documents, deadlines for applications, and whether there are any specific entrance exams that I need to take before my application is considered.","I am, uhm, planning to apply to the Arab Academy, but I would like more detailed information about the admission requirements, including, uhh, necessary documents, deadlines for applications, and whether there are any specific entrance exams, uhm, that I need to take before my application is, uhh, considered.",0.8695641616041424,0.9464671611785889
50_words_sample_with_pause_2.wav," Could you please provide a comprehensive overview of the scholarships available at the Arab Academy for undergraduate students? I am particularly interested in eligibility criteria, application procedures and deadlines, especially for international students who wish to pursue degrees in engineering or business at your institution.","Could you, uhm, please provide a comprehensive overview of the scholarships available at the Arab Academy, uhh, for undergraduate students? I am particularly interested in eligibility criteria, application procedures, and deadlines, uhm, especially for international students who, uhh, wish to pursue degrees in engineering or business at your institution.",0.8776782349316483,0.9654169082641602
50_words_sample_with_pause_3.wav," I need, erham, assistance regarding the process of transferring credits from my previous university to the Arab Academy. Specifically, I would like to know the required documentation and how the evaluation process OOO works to ensure my prior courses are recognized by your institution and accepted, er, for my program.","I need, uhm, assistance regarding the process of transferring credits from my previous university to the Arab Academy. Specifically, uhh, I would like to know the required documentation and how the evaluation process, uhm, works to ensure my prior courses are recognized by your institution and accepted, uhh, for my program.",0.8719665844020316,1.1090314388275146
50_words_sample_with_pause_4.wav," Can you explain the registration process for new students at the Arab Academy? I would like to know the important dates to keep in mind, as well as any orientation sessions that I need to attend before the start of classes at the Academy.","Can you, uhm, explain the registration process for new students at the Arab Academy? I would like to know, uhh, the important dates to keep in mind, as well as any orientation sessions that, uhm, I need to attend before the start of classes at, uhh, the academy.",0.9077604681050467,0.8746588230133057
50_words_sample_with_pause_5.wav," I am very interested in, uh, handing more about the various engineering specializations offered at the Arab Academy. Could you, uh, provide detailed information about the curriculum, faculty, and the potential career paths that graduates, uh, typically follow after completing their degrees in, uh, these engineering-related fields?","I am very interested in, uhm, learning more about the various engineering specializations offered at the Arab Academy. Could you, uhh, provide detailed information about the curriculum, faculty, and the potential career paths that graduates, uhm, typically follow after completing their degrees in, uhh, these engineering-related fields?",0.7032825996613278,1.121997356414795
