File,Whisper Output,Correct Transcription,Cosine Similarity,Transcription Time
10_words_sample_1.wav, Can you provide details on admission deadlines for Arab Academy?,Can you provide details on admission deadlines for Arab Academy?,0.9999999999999999,1.2541756629943848
10_words_sample_2.wav, I need help registering for courses at the Arab Academy.,I need help registering for courses at the Arab Academy.,0.9999999999999997,1.1501448154449463
10_words_sample_3.wav, What are the available scholarships for students at Arab Academy?,What are the available scholarships for students at Arab Academy?,0.9999999999999999,1.1912755966186523
10_words_sample_4.wav, How can I transfer credits to the Arab Academy program?,How can I transfer credits to the Arab Academy program?,0.9999999999999997,1.2087571620941162
10_words_sample_5.wav, Could you explain the tuition fees for programs at Arab Academy?,Could you explain the tuition fees for programs at Arab Academy?,1.0000000000000002,1.2123627662658691
20_words_sample_1.wav, I am interested in applying to the Arab Academy and need information regarding admission requirements and deadlines for international students.,I am interested in applying to the Arab Academy and need information regarding admission requirements and deadlines for international students.,1.0000000000000004,2.866609573364258
20_words_sample_2.wav, Could you please provide details about the scholarships available at the Arab Academy for undergraduate students pursuing engineering and business degrees?,Could you please provide details about the scholarships available at the Arab Academy for undergraduate students pursuing engineering and business degrees?,1.0,2.6235790252685547
20_words_sample_3.wav," I have questions about transferring credits from another university to the Arab Academy, especially for courses in the Computer Science department.","I have questions about transferring credits from another university to the Arab Academy, especially for courses in the computer science department.",0.9999999999999997,2.5505495071411133
20_words_sample_4.wav," I would like assistance with registering for courses at the Arab Academy, specifically regarding important dates and required documents for enrolment.","I would like assistance with registering for courses at the Arab Academy, specifically regarding important dates and required documents for enrollment.",0.9140237818768355,3.730529546737671
20_words_sample_5.wav, Can you explain the differences between the engineering specialisations at the Arab Academy and the career opportunities available for graduates?,Can you explain the differences between the engineering specializations at the Arab Academy and the career opportunities available for graduates?,0.9400966710533992,3.3232076168060303
30_words_sample_1.wav," I'm considering applying to the Arab Academy, but I'd like to know more about the specific entry requirements, deadlines, and the exams required for their engineering and business programmes.","I'm considering applying to the Arab Academy, but I'd like to know more about the specific entry requirements, deadlines, and the exams required for their engineering and business programs.",0.9479838079819543,3.725752115249634
30_words_sample_2.wav," Could you provide a detailed breakdown of tuition costs at the Arab Academy, including any additional fees for accommodation, textbooks, and lab equipment for science and technology courses?","Could you provide a detailed breakdown of tuition costs at the Arab Academy, including any additional fees for accommodation, textbooks, and lab equipment for science and technology courses?",0.9999999999999994,2.7495522499084473
30_words_sample_3.wav," I want to transfer credits from another institution to the Arab Academy, and I need to understand how the process works, including which courses are eligible for transfer and the documentation needed.","I want to transfer credits from another institution to the Arab Academy, and I need to understand how the process works, including which courses are eligible for transfer and the documentation needed.",1.0000000000000002,2.759774923324585
30_words_sample_4.wav," I'm trying to decide which campus of the Arab Academy would be the best option for me and I need more details about the different facilities, faculty expertise and campus services they offer.","I'm trying to decide which campus of the Arab Academy would be the best option for me, and I need more details about the different facilities, faculty expertise, and campus services they offer.",1.0000000000000002,2.6923630237579346
30_words_sample_5.wav," Can you explain how the Arab Academy's online learning programmes are structured, particularly how assessments and exams are conducted for students who are pursuing degrees remotely?","Can you explain how the Arab Academy's online learning programs are structured, particularly how assessments and exams are conducted for students who are pursuing degrees remotely?",0.9435221326704756,2.3505051136016846
40_words_sample_1.wav," I am interested in applying to the Arab Academy, but I would like detailed information regarding the admission process, including all necessary documents, important deadlines, and whether there are any entrance exams that I need to prepare for.","I am interested in applying to the Arab Academy, but I would like detailed information regarding the admission process, including all necessary documents, important deadlines, and whether there are any entrance exams that I need to prepare for.",1.0000000000000002,2.8722119331359863
40_words_sample_2.wav," Could you provide a comprehensive overview of the scholarship opportunities available at the Arab Academy for undergraduate students, particularly for those studying engineering and business, including application procedures and eligibility criteria for international applicants?","Could you provide a comprehensive overview of the scholarship opportunities available at the Arab Academy for undergraduate students, particularly for those studying engineering and business, including application procedures and eligibility criteria for international applicants?",1.0000000000000007,2.6574809551239014
40_words_sample_3.wav," I need assistance with transferring my credits from another university to the Arab Academy, specifically regarding the required documentation and the evaluation process to ensure that my previous courses align with your program's requirements.","I need assistance with transferring my credits from another university to the Arab Academy, specifically regarding the required documentation and the evaluation process to ensure that my previous courses align with your program's requirements.",1.0000000000000004,2.507270336151123
40_words_sample_4.wav," Can you explain how the registration process works for new students at the Arab Academy, including any important dates I should keep in mind, and whether there are orientation sessions that I need to attend before classes start?","Can you explain how the registration process works for new students at the Arab Academy, including any important dates I should keep in mind and whether there are orientation sessions that I need to attend before classes start?",0.9999999999999992,2.822619915008545
40_words_sample_5.wav," I would like to know more about the various engineering specializations offered at the Arab Academy, including the curriculum details and potential career paths that graduates typically pursue after completing their degrees in these fields.","I would like to know more about the various engineering specializations offered at the Arab Academy, including the curriculum details and potential career paths that graduates typically pursue after completing their degrees in these fields.",1.0000000000000002,6.057586669921875
50_words_sample_1.wav," I am planning to apply to the Arab Academy, but I would like more detailed information about the admission requirements, including necessary documents, deadlines for applications, and whether there are any specific entrance exams I need to take before my application is considered.","I am planning to apply to the Arab Academy, but I would like more detailed information about the admission requirements, including necessary documents, deadlines for applications, and whether there are any specific entrance exams I need to take before my application is considered.",1.0000000000000002,4.114132642745972
50_words_sample_2.wav," Could you please provide a comprehensive overview of the scholarships available at the Arab Academy for undergraduate students? I am particularly interested in eligibility criteria, application procedures and deadlines, especially for international students who wish to pursue degrees in engineering or business.","Could you please provide a comprehensive overview of the scholarships available at the Arab Academy for undergraduate students? I am particularly interested in eligibility criteria, application procedures, and deadlines, especially for international students who wish to pursue degrees in engineering or business.",1.0000000000000007,4.759702920913696
50_words_sample_3.wav," I need assistance regarding the process of transferring credits from my previous university to the Arab Academy. Specifically, I would like to know the required documentation and how the evaluation process works to ensure my prior courses are recognised by your institution.","I need assistance regarding the process of transferring credits from my previous university to the Arab Academy. Specifically, I would like to know the required documentation and how the evaluation process works to ensure my prior courses are recognized by your institution.",0.9686332393646815,4.212284803390503
50_words_sample_4.wav," Can you explain the registration process for new students at the Arab Academy? I would like to know the important dates to keep in mind, as well as any orientation sessions that I need to attend before the start of classes.","Can you explain the registration process for new students at the Arab Academy? I would like to know the important dates to keep in mind, as well as any orientation sessions that I need to attend before the start of classes.",1.0000000000000002,3.4299662113189697
50_words_sample_5.wav," I am very interested in learning more about the various engineering specializations offered at the Arab Academy. Could you provide detailed information about the curriculum, faculty, and potential career paths that graduates typically follow after completing their degrees in those fields?","I am very interested in learning more about the various engineering specializations offered at the Arab Academy. Could you provide detailed information about the curriculum, faculty, and potential career paths that graduates typically follow after completing their degrees in those fields?",1.0000000000000004,4.738950967788696
